{
  "schema_version": 1,
  "updated_at": "2026-10-24",
  "tiers": {
    "mechanical": {
      "advisor": null,
      "lead": null,
      "planner": {
        "provider": "openai",
        "id": "gpt-6.1-sol",
        "agent": "pi",
        "effort": "high"
      },
      "builder": {
        "provider": "anthropic",
        "id": "claude-sonnet-5-5",
        "agent": "claude",
        "effort": "high"
      },
      "reviewer": {
        "provider": "anthropic",
        "id": "claude-opus-5-5",
        "agent": "claude",
        "effort": "high"
      }
    },
    "build": {
      "advisor": null,
      "lead": {
        "provider": "openai",
        "id": "gpt-6-astra",
        "agent": "pi",
        "effort": "high",
        "fallback": [
          {
            "provider": "openai",
            "id": "gpt-6.1-sol",
            "agent": "pi",
            "effort": "high"
          }
        ]
      },
      "planner": {
        "provider": "openai",
        "id": "gpt-6.1-sol",
        "agent": "pi",
        "effort": "high"
      },
      "builder": {
        "provider": "anthropic",
        "id": "claude-sonnet-5-5",
        "agent": "claude",
        "effort": "high"
      },
      "reviewer": {
        "provider": "anthropic",
        "id": "claude-opus-5-5",
        "agent": "claude",
        "effort": "high"
      }
    },
    "judge": {
      "advisor": null,
      "lead": {
        "provider": "openai",
        "id": "gpt-6-astra",
        "agent": "pi",
        "effort": "high",
        "fallback": [
          {
            "provider": "openai",
            "id": "gpt-6.1-sol",
            "agent": "pi",
            "effort": "high"
          }
        ]
      },
      "planner": {
        "provider": "openai",
        "id": "gpt-6.1-sol",
        "agent": "pi",
        "effort": "xhigh"
      },
      "builder": {
        "provider": "anthropic",
        "id": "claude-sonnet-5-5",
        "agent": "claude",
        "effort": "xhigh"
      },
      "reviewer": {
        "provider": "anthropic",
        "id": "claude-opus-5-5",
        "agent": "claude",
        "effort": "xhigh"
      },
      "tech-lead": {
        "provider": "anthropic",
        "id": "claude-opus-5-5",
        "agent": "claude",
        "effort": "xhigh",
        "fallback": [
          {
            "provider": "anthropic",
            "id": "claude-fable-5-1",
            "agent": "claude",
            "effort": "medium"
          }
        ]
      }
    }
  },
  "models": {
    "anthropic/claude-opus-5-5": {
      "cost_in_per_mtok": 4,
      "cost_out_per_mtok": 20,
      "cost_cache_read_per_mtok": 0.2,
      "cost_cache_write_per_mtok": 8,
      "cache_rate_source": "models.dev lists anthropic/claude-opus-5-5 at input 4, cacheRead 0.2 and cacheWrite 5 per Mtok. The cache read is recorded as published: 0.05x, not the 0.10x other anthropic entries carry. models.dev's cacheWrite is the 5-minute rate; this entry prices writes at the ratified 1h-TTL rate, because billed_cache_write_tokens collapses both TTLs into one column and the anthropic convention prices that column at 1h. Claude Code 2.1.280's model price table publishes that rate for this model (tier_4_20_cache_read_0_20: cache_write_5m 5, cache_write_1h 8), equal to anthropic's 2.00x multiplier.",
      "context": 1000000,
      "tags": [
        "reasoning",
        "tool-call",
        "judge"
      ],
      "source": "models.dev",
      "last_verified": "2026-09-23"
    },
    "anthropic/claude-opus-5": {
      "cost_in_per_mtok": 5,
      "cost_out_per_mtok": 25,
      "cost_cache_read_per_mtok": 0.5,
      "cost_cache_write_per_mtok": 10,
      "cache_rate_source": "anthropic published prompt-caching multipliers applied to this entry's own cost_in_per_mtok: cache read 0.10x, 1h-TTL cache write 2.00x. billed_cache_write_tokens collapses the 1h and 5m TTLs into one column, so pricing every cache write at the 1h rate is an explicit lossy convention, not a reconstruction of any session's TTL; 1h is the ratified one because this task's acceptance figures require it and because both sampled b168-paneusage claude-opus-5 pane seats used only 1h writes.",
      "context": 1000000,
      "tags": [
        "reasoning",
        "tool-call",
        "judge",
        "override-only"
      ],
      "source": "models.dev",
      "last_verified": "2026-08-13"
    },
    "anthropic/claude-sonnet-5": {
      "cost_in_per_mtok": 2,
      "cost_out_per_mtok": 10,
      "cost_cache_read_per_mtok": 0.2,
      "cost_cache_write_per_mtok": 4,
      "cache_rate_source": "anthropic published prompt-caching multipliers applied to this entry's own cost_in_per_mtok: cache read 0.10x, 1h-TTL cache write 2.00x. billed_cache_write_tokens collapses the 1h and 5m TTLs into one column, so pricing every cache write at the 1h rate is an explicit lossy convention, not a reconstruction of any session's TTL; 1h is the ratified one because this task's acceptance figures require it and because both sampled b168-paneusage claude-opus-5 pane seats used only 1h writes.",
      "context": 1000000,
      "tags": [
        "reasoning",
        "tool-call",
        "workhorse",
        "override-only"
      ],
      "source": "models.dev",
      "last_verified": "2026-08-13"
    },
    "anthropic/claude-sonnet-5-5": {
      "cost_in_per_mtok": 2,
      "cost_out_per_mtok": 10,
      "cost_cache_read_per_mtok": 0.2,
      "cost_cache_write_per_mtok": 4,
      "cache_rate_source": "models.dev lists anthropic/claude-sonnet-5-5 at input 2, cacheRead 0.2 and cacheWrite 2.5 per Mtok. The cache read is recorded as published: models.dev publishes 0.2, which is the 0.10x multiplier, and the operator ratified that figure on 2026-09-30. models.dev's cacheWrite is the 5-minute rate; this entry prices writes at the ratified 1h-TTL rate, 2.00x cost_in_per_mtok, because billed_cache_write_tokens collapses both TTLs into one column and the anthropic convention prices that column at 1h. That 1h rate is derived from the multiplier, not read from a published per-model figure.",
      "context": 1000000,
      "tags": [
        "reasoning",
        "tool-call",
        "workhorse"
      ],
      "source": "models.dev",
      "last_verified": "2026-09-30"
    },
    "anthropic/claude-haiku-4-5": {
      "cost_in_per_mtok": 1,
      "cost_out_per_mtok": 5,
      "cost_cache_read_per_mtok": 0.1,
      "cost_cache_write_per_mtok": 2,
      "cache_rate_source": "anthropic published prompt-caching multipliers applied to this entry's own cost_in_per_mtok: cache read 0.10x, 1h-TTL cache write 2.00x. billed_cache_write_tokens collapses the 1h and 5m TTLs into one column, so pricing every cache write at the 1h rate is an explicit lossy convention, not a reconstruction of any session's TTL; 1h is the ratified one because this task's acceptance figures require it and because both sampled b168-paneusage claude-opus-5 pane seats used only 1h writes.",
      "context": 200000,
      "tags": [
        "reasoning",
        "tool-call",
        "cheap"
      ],
      "source": "models.dev",
      "last_verified": "2026-08-13"
    },
    "openai/gpt-6-sol": {
      "cost_in_per_mtok": 2,
      "cost_out_per_mtok": 10,
      "cost_cache_read_per_mtok": 0.2,
      "cost_cache_write_per_mtok": 2.5,
      "cache_rate_source": "models.dev lists cache writes at 2.5 per Mtok for openai/gpt-6-sol, contradicting the older statement that OpenAI cache writes are not charged. It lists openai/gpt-6-sol at input 2, output 10, cacheRead 0.2, cacheWrite 2.5 per Mtok. It also declares a second price tier above 272000 input tokens (input 4, output 15, cacheRead 0.4, cacheWrite 5) that this single-rate entry cannot represent; the openai-codex route this model is seated through serves a 272K context, so one request cannot reach it there, but a route serving the listed 1050000 context would be underpriced by this entry.",
      "context": 1050000,
      "tags": [
        "reasoning",
        "tool-call",
        "vendor-diverse",
        "override-only"
      ],
      "source": "models.dev",
      "last_verified": "2026-09-23"
    },
    "openai/gpt-6.1-sol": {
      "cost_in_per_mtok": 2,
      "cost_out_per_mtok": 10,
      "cost_cache_read_per_mtok": 0.1,
      "cost_cache_write_per_mtok": 2.5,
      "cache_rate_source": "models.dev lists openai/gpt-6.1-sol at input 2, output 10, cacheRead 0.1, cacheWrite 2.5 per Mtok. The cache read is recorded as published: 0.05x, not the 0.10x multiplier (openai/gpt-6-sol was listed at 0.2); models.dev publishes 0.1 and the operator ratified that figure on 2026-09-30. It also declares a second price tier above 272000 input tokens (input 4, output 15, cacheRead 0.2, cacheWrite 5) that this single-rate entry cannot represent; usage above it is underpriced by this entry.",
      "context": 1050000,
      "tags": [
        "reasoning",
        "tool-call",
        "vendor-diverse"
      ],
      "source": "models.dev",
      "last_verified": "2026-09-30"
    },
    "openai/gpt-5.6-sol": {
      "cost_in_per_mtok": 4,
      "cost_out_per_mtok": 20,
      "cost_cache_read_per_mtok": 0.4,
      "cost_cache_write_per_mtok": 0,
      "cache_rate_source": "openai published prompt-caching rates applied to this entry's own cost_in_per_mtok: cached input 0.10x, and cache writes are not charged, so cost_cache_write_per_mtok is a published 0.00x rate rather than an absent one.",
      "context": 1050000,
      "tags": [
        "reasoning",
        "tool-call",
        "vendor-diverse",
        "override-only"
      ],
      "source": "models.dev",
      "last_verified": "2026-08-30"
    },
    "openai/gpt-5.6-terra": {
      "cost_in_per_mtok": 2,
      "cost_out_per_mtok": 12,
      "cost_cache_read_per_mtok": 0.2,
      "cost_cache_write_per_mtok": 2.5,